{
  "$schema": "https://json-schema.org/draft/2020-12/schema",
  "$id": "https://vimwilds.local/schemas/unit-content.schema.json",
  "title": "Vim Wilds curriculum unit",
  "type": "object",
  "additionalProperties": false,
  "required": ["schemaVersion", "contentVersion", "unitNumber", "id", "title", "releaseStatus", "curriculumDefinition", "playback", "generation", "lessons", "reference", "coverage"],
  "allOf": [
    {
      "if": { "properties": { "surface": { "const": "mastery" } }, "required": ["surface"] },
      "else": {
        "properties": {
          "reference": { "minItems": 1 },
          "coverage": { "minItems": 1 }
        }
      }
    }
  ],
  "properties": {
    "schemaVersion": {"const": 1},
    "contentVersion": {"type": "string", "pattern": "^[0-9]+\\.[0-9]+\\.[0-9]+$"},
    "unitNumber": {"type": "integer", "minimum": 1},
    "id": {"$ref": "#/$defs/id"},
    "title": {"type": "string", "minLength": 1},
    "surface": {"enum": ["lesson", "mastery"]},
    "releaseStatus": {"enum": ["authoring", "browser-verified", "released"]},
    "curriculumDefinition": {"$ref": "#/$defs/curriculumDefinition"},
    "prerequisiteSkillIds": {"type": "array", "items": {"$ref": "#/$defs/id"}, "uniqueItems": true, "description": "Units this one genuinely requires, as direct edges only. The transitive closure is computed by the reader, so listing an ancestor of a listed unit is redundant rather than safer. Named \"skill\" ids for historical reasons; the values are unit ids."},
    "recommendedSkillIds": {"type": "array", "items": {"$ref": "#/$defs/id"}, "uniqueItems": true, "description": "Units that make this one easier but are not required. Disjoint from prerequisiteSkillIds. Nothing is ever locked for want of a recommendation."},
    "playback": {"$ref": "#/$defs/playback"},
    "generation": {"$ref": "#/$defs/generationPolicy"},
    "lessons": {"type": "array", "minItems": 1, "items": {"$ref": "#/$defs/lesson"}},
    "reference": {"type": "array", "items": {"$ref": "#/$defs/referenceEntry"}},
    "coverage": {"type": "array", "items": {"$ref": "#/$defs/coverageEntry"}}
  },
  "$defs": {
    "id": {"type": "string", "pattern": "^[a-z0-9]+(?:-[a-z0-9]+)*$"},
    "position": {"type": "array", "prefixItems": [{"type": "integer", "minimum": 0}, {"type": "integer", "minimum": 0}], "items": false},
    "mode": {"enum": ["normal", "insert", "replace", "operator-pending", "visual", "visual-line", "visual-block", "command-line"]},
    "step": {"oneOf":[{"type":"string","minLength":1},{"type":"object","additionalProperties":false,"required":["key","kind"],"properties":{"key":{"type":"string","minLength":1},"kind":{"enum":["command","count","operator","motion","text-object","literal","control"]},"cue":{"type":"string"}}}]},
    "routes": {"type":"array","minItems":1,"items":{"type":"object","additionalProperties":false,"required":["id","label","activityRef","emphasis"],"properties":{"id":{"$ref":"#/$defs/id"},"label":{"type":"string"},"activityRef":{"$ref":"#/$defs/id"},"emphasis":{"enum":["primary","secondary"]}}}},
    "curriculumDefinition": {
      "type": "object", "additionalProperties": false,
      "required": ["unit", "commandsAndConcepts", "prerequisites", "learningOutcome", "representativeExercises", "priorityAndPortability"],
      "properties": {
        "unit": {"type": "string"}, "commandsAndConcepts": {"type": "string"}, "prerequisites": {"type": "string"},
        "learningOutcome": {"type": "string"}, "representativeExercises": {"type": "string"}, "priorityAndPortability": {"type": "string"}
      }
    },
    "playback": {
      "type": "object", "additionalProperties": false,
      "required": ["modes", "manualStep", "reset", "backwardStep"],
      "properties": {
        "modes": {"type": "array", "contains": {"const": "normal"}, "items": {"enum": ["normal", "slow", "manual"]}, "uniqueItems": true},
        "manualStep": {"const": "one-input-or-text-run"}, "reset": {"const": "initial-state"}, "backwardStep": {"const": "previous-manual-step"}
      }
    },
    "generationPolicy": {
      "type": "object", "additionalProperties": false,
      "required": ["stage", "candidateCount", "promptVersion", "correctnessAuthority", "runtimeDependency"],
      "properties": {
        "stage": {"const": "authoring"}, "candidateCount": {"type": "integer", "minimum": 2}, "promptVersion": {"type": "string"},
        "correctnessAuthority": {"const": "deterministic-editor"}, "runtimeDependency": {"const": false}
      }
    },
    "lesson": {
      "type": "object", "additionalProperties": false,
      "required": ["id", "title", "objective", "activities"],
      "if": {"required": ["track"]}, "then": {"required": ["trackNote"]},
      "properties": {
        "id": {"$ref": "#/$defs/id"}, "title": {"type": "string"}, "objective": {"type": "string"},
        "flow": {"const": "authored", "description": "Present non-practice activities in their authored position around the practice block instead of introducing them all first. Absent means the default lesson flow, which leads with theory and demonstrations and closes with the choice and summary. Capstones set this because they ask for a mechanism before any keys and compare the rejected alternative only after the work is done."},
        "track": {"enum": ["core", "advanced", "optional"], "description": "Recommended-path weight. Absent means core. \"advanced\" marks material that is real but less commonly reached for; \"optional\" marks material that depends on configuration, file type, or host. Nothing is removed from the path for being rare; it is marked."},
        "trackNote": {"type": "string", "description": "One sentence saying why the lesson carries its track. Required whenever track is present, and opens with the fixed lead phrase for that track."},
        "activities": {"type": "array", "minItems": 1, "items": {"oneOf": [{"$ref": "#/$defs/theory"}, {"$ref": "#/$defs/runnable"}, {"$ref": "#/$defs/choice"}, {"$ref": "#/$defs/summary"}]}}
      }
    },
    "commonActivity": {
      "type": "object",
      "required": ["id", "type", "phase", "title"]
    },
    "theory": {
      "allOf": [
        {"$ref": "#/$defs/commonActivity"},
        {"type": "object", "additionalProperties": false, "required": ["id", "type", "phase", "title", "body"],
          "properties": {"id":{"$ref":"#/$defs/id"},"type":{"const":"theory"},"phase":{"const":"explain"},"title":{"type":"string"},"body":{"type":"string"},"grammar":{"type":"string"},"contrast":{"type":"string"},"demoRef":{"$ref":"#/$defs/id"},"presentation":{"$ref":"#/$defs/presentation"},"routes":{"$ref":"#/$defs/routes"}}}
      ]
    },
    "runnable": {
      "allOf": [
        {"$ref": "#/$defs/commonActivity"},
        {"type": "object", "additionalProperties": false,
          "required": ["id", "type", "phase", "title", "instruction", "languageId", "sourceKind", "scenario", "script", "hints", "feedback", "skills", "difficulty", "portability", "provenance", "verification"],
          "properties": {
            "id":{"$ref":"#/$defs/id"},"type":{"enum":["demo","exercise"]},"phase":{"enum":["demonstrate","isolate","mix","challenge"]},"title":{"type":"string"},"instruction":{"type":"string"},
            "languageId":{"$ref":"#/$defs/id"},"sourceKind":{"enum":["complete","fragment","neutral"]},"scenario":{"$ref":"#/$defs/scenario"},"script":{"$ref":"#/$defs/script"},
            "hints":{"type":"array","items":{"type":"string"}},"feedback":{"$ref":"#/$defs/feedback"},"skills":{"$ref":"#/$defs/skills"},"difficulty":{"$ref":"#/$defs/difficulty"},
            "portability":{"type":"string"},"provenance":{"$ref":"#/$defs/provenance"},"verification":{"$ref":"#/$defs/verification"},
            "delivery":{"enum":["guided","guided-then-recall","recall"]},"remediationRef":{"$ref":"#/$defs/id"},"routes":{"$ref":"#/$defs/routes"},"editor":{"$ref":"#/$defs/editorConfig"},
            "fileName":{"type":"string","pattern":"^[A-Za-z0-9][A-Za-z0-9._-]*$","description":"A bare file name with no path separator, read by `\"%` and `Ctrl-r%`. Its extension must belong to the declared languageId. Omit it for an unnamed buffer, which reports an empty `\"%` exactly as Vim does."}
          }}
      ]
    },
    "editorConfig": {
      "type":"object","additionalProperties":false,
      "allOf":[{"not":{"required":["requiredRows","viewportRows"]}},{"if":{"required":["viewportDependent"]},"then":{"required":["viewportRows"]}}],
      "properties":{
        "wrapColumns":{"type":"integer","minimum":12,"maximum":80},
        "textWidth":{"type":"integer","minimum":20,"maximum":80,"description":"Set Vim textwidth for deterministic gq/gw formatting."},
        "requiredRows":{"type":"integer","minimum":1,"maximum":12,"description":"Reserve at least this many logical rows when authored transient states need more space than initial, target, or checkpoints reveal."},
        "viewportRows":{"type":"integer","minimum":5,"maximum":12,"description":"Fix the editor to an exact number of 24px logical rows for deterministic viewport lessons."},
        "viewportDependent":{"type":"boolean","description":"Declare that this activity's correctness depends on the visible row count, because it asserts a semantic viewport in scenario.target or script.checkpoints. Presentation-only viewport activities frame a long buffer without asserting one and must omit this flag."},
        "visualizeWhitespace":{"type":"boolean","description":"Render spaces as dots and tabs as arrows for this activity."}
      }
    },
    "presentation": {
      "oneOf": [
        {"type":"object","additionalProperties":false,"required":["kind","transitions"],"properties":{"kind":{"const":"mode-compass"},"transitions":{"type":"array","minItems":1,"items":{"type":"object","additionalProperties":false,"required":["mode","enterKeys","exitKeys","purpose"],"properties":{"mode":{"$ref":"#/$defs/mode"},"enterKeys":{"type":"array","items":{"type":"string"}},"exitKeys":{"type":"array","items":{"type":"string"}},"purpose":{"type":"string"}}}}}},
        {"type":"object","additionalProperties":false,"required":["kind","parts"],"properties":{"kind":{"const":"command-assembly"},"parts":{"type":"array","minItems":1,"items":{"type":"object","additionalProperties":false,"required":["role","keys","meaning"],"properties":{"role":{"enum":["count","operator","motion","text-object"]},"keys":{"type":"string"},"meaning":{"type":"string"}}}}}}
      ]
    },
    "scenario": {
      "type":"object","additionalProperties":false,"required":["initial","target"],
      "properties": {
        "initial":{"$ref":"#/$defs/initialState"},
        "target":{"type":"object","additionalProperties":false,"required":["lines","mode"],"properties":{"lines":{"$ref":"#/$defs/lines"},"cursor":{"$ref":"#/$defs/position"},"mode":{"$ref":"#/$defs/mode"},"registers":{"$ref":"#/$defs/registerExpectations"},"viewport":{"$ref":"#/$defs/viewport"}}}
      }
    },
    "initialState": {"type":"object","additionalProperties":false,"required":["lines","cursor","mode"],"properties":{"lines":{"$ref":"#/$defs/lines"},"cursor":{"$ref":"#/$defs/position"},"mode":{"$ref":"#/$defs/mode"},"viewport":{"$ref":"#/$defs/viewport"},"setup":{"type":"object","additionalProperties":false,"required":["cursor","steps"],"properties":{"cursor":{"$ref":"#/$defs/position"},"steps":{"type":"array","minItems":1,"items":{"$ref":"#/$defs/step"}}}}}},
    "lines": {"type":"array","minItems":1,"items":{"type":"string"}},
    "script": {
      "type":"object","additionalProperties":false,"required":["steps","commandGroups","checkpoints"],
      "properties": {
        "steps":{"type":"array","minItems":1,"items":{"$ref":"#/$defs/step"}},
        "commandGroups":{"type":"array","minItems":1,"items":{"type":"object","additionalProperties":false,"required":["from","to","display","explanation"],"properties":{"from":{"type":"integer","minimum":0},"to":{"type":"integer","minimum":1},"display":{"type":"string"},"explanation":{"type":"string"}}}},
        "checkpoints":{"type":"array","minItems":1,"items":{"type":"object","additionalProperties":false,"required":["afterStep"],"properties":{"afterStep":{"type":"integer","minimum":1},"lines":{"$ref":"#/$defs/lines"},"cursor":{"$ref":"#/$defs/position"},"mode":{"$ref":"#/$defs/mode"},"registers":{"$ref":"#/$defs/registerExpectations"},"viewport":{"$ref":"#/$defs/viewport"},"affectedRange":{"$ref":"#/$defs/range"},"caption":{"type":"string"}}}}
      }
    },
    "registerExpectations":{"type":"object","propertyNames":{"pattern":"^[\"0-9a-z+_./:%-]$"},"additionalProperties":{"type":"object","additionalProperties":false,"required":["text","type"],"properties":{"text":{"type":"string"},"type":{"enum":["characterwise","linewise","blockwise"]}}}},
    "range": {"type":"object","additionalProperties":false,"required":["from","to"],"properties":{"from":{"$ref":"#/$defs/position"},"to":{"$ref":"#/$defs/position"}}},
    "viewport": {"type":"object","additionalProperties":false,"required":["topLine","bottomLine"],"properties":{"topLine":{"type":"integer","minimum":0},"bottomLine":{"type":"integer","minimum":0}}},
    "feedback":{"type":"object","additionalProperties":false,"required":["success","why"],"properties":{"success":{"type":"string"},"why":{"type":"string"},"contrast":{"type":"string"}}},
    "skills":{"type":"object","additionalProperties":false,"required":["primary","supporting"],"properties":{"primary":{"type":"array","minItems":1,"items":{"$ref":"#/$defs/id"},"uniqueItems":true},"supporting":{"type":"array","items":{"$ref":"#/$defs/id"},"uniqueItems":true}}},
    "difficulty":{"type":"object","additionalProperties":false,"required":["level","dimensions"],"properties":{"level":{"enum":["guided","easy","medium","hard"]},"dimensions":{"type":"array","items":{"type":"string"},"uniqueItems":true}}},
    "provenance":{"type":"object","additionalProperties":false,"required":["method","promptVersion","languageRationale","nativeValidation","browserConformance","reviewStatus"],"properties":{"method":{"const":"llm-authored"},"promptVersion":{"type":"string"},"languageRationale":{"type":"string"},"nativeValidation":{"enum":["pending","passed"]},"browserConformance":{"enum":["pending","passed"]},"reviewStatus":{"enum":["draft","reviewed"]}}},
    "verification":{"type":"object","additionalProperties":false,"required":["inputPolicy","requiredEvidence"],"properties":{"inputPolicy":{"const":"exact-sequence"},"requiredEvidence":{"type":"array","minItems":1,"items":{"$ref":"#/$defs/id"},"uniqueItems":true},"routeNote":{"type":"string","minLength":1,"description":"Why this exercise teaches a route longer than one the course already allows, for example a repeatable route a later step pays off. The instruction must tell the learner the same thing. The route audit (npm run audit:routes) reports an exercise with a note as justified instead of flagging it."}}},
    "choice": {
      "allOf":[{"$ref":"#/$defs/commonActivity"},{"type":"object","additionalProperties":false,"required":["id","type","phase","title","prompt","options","correctOptionId","explanation"],"properties":{"id":{"$ref":"#/$defs/id"},"type":{"const":"choice"},"phase":{"const":"challenge"},"title":{"type":"string"},"prompt":{"type":"string"},"options":{"type":"array","minItems":2,"items":{"type":"object","additionalProperties":false,"required":["id","label"],"properties":{"id":{"$ref":"#/$defs/id"},"label":{"type":"string"}}}},"correctOptionId":{"$ref":"#/$defs/id"},"explanation":{"type":"string"},"questionKind":{"enum":["generic","mode-identification","range-prediction","command-classification"]},"inspection":{"type":"object","additionalProperties":false,"required":["initial"],"properties":{"initial":{"$ref":"#/$defs/initialState"},"revealRange":{"$ref":"#/$defs/range"}}},"remediationRef":{"$ref":"#/$defs/id"},"routes":{"$ref":"#/$defs/routes"}}}]
    },
    "summary": {
      "allOf":[{"$ref":"#/$defs/commonActivity"},{"type":"object","additionalProperties":false,"required":["id","type","phase","title","body","takeaways"],"properties":{"id":{"$ref":"#/$defs/id"},"type":{"const":"summary"},"phase":{"const":"summary"},"title":{"type":"string"},"body":{"type":"string"},"takeaways":{"type":"array","minItems":1,"items":{"type":"string"}},"routes":{"$ref":"#/$defs/routes"}}}]
    },
    "referenceEntry":{"type":"object","additionalProperties":false,"required":["id","command","purpose","notes","exampleActivityRefs"],"properties":{"id":{"$ref":"#/$defs/id"},"command":{"type":"string"},"purpose":{"type":"string"},"notes":{"type":"array","items":{"type":"string"}},"exampleActivityRefs":{"type":"array","minItems":1,"items":{"$ref":"#/$defs/id"},"uniqueItems":true}}},
    "coverageEntry":{"type":"object","additionalProperties":false,"required":["id","concept","explain","demonstrate","isolate","mix","challenge"],"properties":{"id":{"$ref":"#/$defs/id"},"concept":{"type":"string"},"explain":{"type":"array","minItems":1,"items":{"$ref":"#/$defs/id"}},"demonstrate":{"type":"array","minItems":1,"items":{"$ref":"#/$defs/id"}},"isolate":{"type":"array","minItems":1,"items":{"$ref":"#/$defs/id"}},"mix":{"type":"array","minItems":1,"items":{"$ref":"#/$defs/id"}},"challenge":{"type":"array","minItems":1,"items":{"$ref":"#/$defs/id"}}}}
  }
}
